{
  "profile_id": "fd59a453-3b4f-4a2d-a9b9-9ce60e892db9",
  "rights_basis": "OTHER_DOCUMENTED_BASIS",
  "static_analysis_allowed": true,
  "dynamic_analysis_allowed": true,
  "network_interception_allowed": false,
  "accepted_by": "jawadresearchai-creator",
  "accepted_at": "2026-09-02T16:17:04Z",
  "constraints": [
    "Scope: docvault-lasttime-fusion / source bundle docvault-lasttime-fusion-20260902.",
    "Document Vault editable source and compiled APK: static analysis authorized; ordinary local/runtime dynamic analysis authorized; source/code reuse, modification, refactoring, and derivative implementation authorized.",
    "LastTime current editable source and Antigravity source variant: static analysis authorized; ordinary local/runtime dynamic analysis authorized; source/code reuse, modification, refactoring, and derivative implementation authorized.",
    "CamScanner APKM: analysis is authorized only to understand externally observable functionality/architecture and to produce a clean-room behavioral specification and behavioral benchmark.",
    "CamScanner direct copying/reuse of proprietary source, protected implementation code, assets, branding, keys, or other proprietary material is prohibited.",
    "Network interception, MITM, traffic decryption, credential extraction, authentication bypass, licensing bypass, and access-control circumvention are prohibited.",
    "AppFusion clean-room, security, budget, exact-hash approval, blueprint-approval, and material-deviation gates remain mandatory."
  ]
}
